{
  "repo_id": 1417456983,
  "repo_name": "HeyPuter/everything",
  "html_url": "https://github.com/HeyPuter/everything",
  "description": null,
  "metadata": {},
  "daily_stars": [
    {
      "date": "2026-10-14",
      "stars": 8
    }
  ],
  "prediction_history": [
    {
      "date": "2026-10-20",
      "rank": 24,
      "prob": 0.0293,
      "raw_score": 0.2506,
      "b1_rank": 42
    }
  ],
  "latest_shap": [],
  "explanation": "Flagged because 14 stars in the last 3 days, 4 stars yesterday and stargazers star selectively. Held back by: recent stargazers have a good track record of finding breakouts early and the owner has 32 other repos.",
  "realized_outcome": null,
  "trending_appearances": [],
  "hn_stories": [],
  "cohort_retention": null,
  "similar_repos": null,
  "suspicion_breakdown": null
}
