{
  "repo_id": 1408289866,
  "repo_name": "storytold/cadcraft",
  "html_url": "https://github.com/storytold/cadcraft",
  "description": null,
  "metadata": {},
  "daily_stars": [
    {
      "date": "2026-10-07",
      "stars": 3
    },
    {
      "date": "2026-10-08",
      "stars": 13
    },
    {
      "date": "2026-10-09",
      "stars": 10
    },
    {
      "date": "2026-10-10",
      "stars": 8
    },
    {
      "date": "2026-10-11",
      "stars": 10
    },
    {
      "date": "2026-10-12",
      "stars": 4
    },
    {
      "date": "2026-10-13",
      "stars": 9
    },
    {
      "date": "2026-10-14",
      "stars": 9
    }
  ],
  "prediction_history": [
    {
      "date": "2026-10-20",
      "rank": 15,
      "prob": 0.0293,
      "raw_score": 0.3046,
      "b1_rank": 8
    }
  ],
  "latest_shap": [],
  "explanation": "Flagged because 11 stars in the last 3 days, stars are spread over many hours and pushed on 6 of the last 14 days. Held back by: recent stargazers have a good track record of finding breakouts early and activity is spread over many event types.",
  "realized_outcome": null,
  "trending_appearances": [],
  "hn_stories": [],
  "cohort_retention": null,
  "similar_repos": null,
  "suspicion_breakdown": null
}
