{
  "repo_id": 1366969284,
  "repo_name": "linguo2625469/workbuddy2api-panel",
  "html_url": "https://github.com/linguo2625469/workbuddy2api-panel",
  "description": null,
  "metadata": {},
  "daily_stars": [
    {
      "date": "2026-09-22",
      "stars": 2
    },
    {
      "date": "2026-09-23",
      "stars": 1
    },
    {
      "date": "2026-09-24",
      "stars": 5
    },
    {
      "date": "2026-09-25",
      "stars": 2
    },
    {
      "date": "2026-09-27",
      "stars": 1
    },
    {
      "date": "2026-09-28",
      "stars": 2
    },
    {
      "date": "2026-09-29",
      "stars": 2
    },
    {
      "date": "2026-09-30",
      "stars": 3
    },
    {
      "date": "2026-10-01",
      "stars": 2
    },
    {
      "date": "2026-10-02",
      "stars": 1
    },
    {
      "date": "2026-10-03",
      "stars": 3
    },
    {
      "date": "2026-10-04",
      "stars": 2
    },
    {
      "date": "2026-10-05",
      "stars": 1
    },
    {
      "date": "2026-10-07",
      "stars": 3
    },
    {
      "date": "2026-10-08",
      "stars": 4
    },
    {
      "date": "2026-10-09",
      "stars": 6
    },
    {
      "date": "2026-10-10",
      "stars": 3
    },
    {
      "date": "2026-10-11",
      "stars": 5
    },
    {
      "date": "2026-10-13",
      "stars": 2
    },
    {
      "date": "2026-10-14",
      "stars": 5
    }
  ],
  "prediction_history": [
    {
      "date": "2026-10-20",
      "rank": 48,
      "prob": 0.0151,
      "raw_score": 0.168,
      "b1_rank": 38
    }
  ],
  "latest_shap": [],
  "explanation": "Flagged because 10 stars in the last 3 days, stargazers star selectively and stars are spread over many hours. Held back by: few recent pushes and recent stargazers have no track record of finding breakouts.",
  "realized_outcome": null,
  "trending_appearances": [],
  "hn_stories": [],
  "cohort_retention": null,
  "similar_repos": null,
  "suspicion_breakdown": null
}
