{
  "repo_id": 1424340323,
  "repo_name": "repo_id=1424340323",
  "html_url": "https://github.com/repo_id=1424340323",
  "description": null,
  "metadata": {},
  "daily_stars": [],
  "prediction_history": [
    {
      "date": "2026-10-20",
      "rank": 16,
      "prob": 0.0293,
      "raw_score": 0.2795,
      "b1_rank": 288
    }
  ],
  "latest_shap": [],
  "explanation": "Flagged because 9 stars yesterday, 12 stars in the last 3 days and recent stargazers have a good track record of finding breakouts early. Held back by: few recent pushes and 15 active user-days in two weeks.",
  "realized_outcome": null,
  "trending_appearances": [],
  "hn_stories": [],
  "cohort_retention": null,
  "similar_repos": null,
  "suspicion_breakdown": null
}
