{
  "repo_id": 430744346,
  "repo_name": "repo_id=430744346",
  "html_url": "https://github.com/repo_id=430744346",
  "description": null,
  "metadata": {},
  "daily_stars": [],
  "prediction_history": [
    {
      "date": "2026-10-20",
      "rank": 162,
      "prob": 0.0034,
      "raw_score": 0.0482,
      "b1_rank": 127
    }
  ],
  "latest_shap": [],
  "explanation": null,
  "realized_outcome": null,
  "trending_appearances": [
    {
      "date": "2026-10-02",
      "rank": 15,
      "language": "rust",
      "source": "larsbijl"
    },
    {
      "date": "2026-10-02",
      "rank": 7,
      "language": "rust",
      "source": "antonkomarev"
    },
    {
      "date": "2026-10-01",
      "rank": 7,
      "language": "rust",
      "source": "larsbijl"
    }
  ],
  "hn_stories": [],
  "cohort_retention": null,
  "similar_repos": null,
  "suspicion_breakdown": null
}
