{
  "repo_id": 1369141830,
  "repo_name": "waligoraamodio288-rgb/hongguo-desktop-releases",
  "html_url": "https://github.com/waligoraamodio288-rgb/hongguo-desktop-releases",
  "description": null,
  "metadata": {},
  "daily_stars": [
    {
      "date": "2026-09-25",
      "stars": 2
    },
    {
      "date": "2026-09-26",
      "stars": 3
    },
    {
      "date": "2026-09-29",
      "stars": 1
    },
    {
      "date": "2026-09-30",
      "stars": 1
    },
    {
      "date": "2026-10-01",
      "stars": 1
    },
    {
      "date": "2026-10-02",
      "stars": 2
    },
    {
      "date": "2026-10-03",
      "stars": 2
    },
    {
      "date": "2026-10-04",
      "stars": 2
    },
    {
      "date": "2026-10-05",
      "stars": 2
    },
    {
      "date": "2026-10-06",
      "stars": 9
    },
    {
      "date": "2026-10-07",
      "stars": 11
    },
    {
      "date": "2026-10-08",
      "stars": 4
    },
    {
      "date": "2026-10-09",
      "stars": 8
    },
    {
      "date": "2026-10-10",
      "stars": 1
    },
    {
      "date": "2026-10-11",
      "stars": 4
    },
    {
      "date": "2026-10-12",
      "stars": 1
    },
    {
      "date": "2026-10-13",
      "stars": 1
    },
    {
      "date": "2026-10-14",
      "stars": 1
    }
  ],
  "prediction_history": [
    {
      "date": "2026-10-20",
      "rank": 47,
      "prob": 0.0151,
      "raw_score": 0.1741,
      "b1_rank": 26
    }
  ],
  "latest_shap": [],
  "explanation": "Flagged because 9 stars in the last 3 days, stars are spread over many hours and stargazers star selectively. Held back by: no stargazer with a good record and recent stargazers have no track record of finding breakouts.",
  "realized_outcome": null,
  "trending_appearances": [],
  "hn_stories": [],
  "cohort_retention": null,
  "similar_repos": null,
  "suspicion_breakdown": null
}
