{
  "repo_id": 1404197626,
  "repo_name": "openfilm/openfilm",
  "html_url": "https://github.com/openfilm/openfilm",
  "description": null,
  "metadata": {},
  "daily_stars": [
    {
      "date": "2026-10-11",
      "stars": 1
    },
    {
      "date": "2026-10-12",
      "stars": 1
    },
    {
      "date": "2026-10-13",
      "stars": 2
    },
    {
      "date": "2026-10-14",
      "stars": 3
    }
  ],
  "prediction_history": [
    {
      "date": "2026-10-20",
      "rank": 32,
      "prob": 0.0151,
      "raw_score": 0.219,
      "b1_rank": 139
    }
  ],
  "latest_shap": [],
  "explanation": "Flagged because 9 stars in the last 3 days, 4 stars yesterday and stargazers star selectively. Held back by: owner type unknown.",
  "realized_outcome": null,
  "trending_appearances": [],
  "hn_stories": [],
  "cohort_retention": null,
  "similar_repos": null,
  "suspicion_breakdown": null
}
