{
  "repo_id": 1412548284,
  "repo_name": "storytold/craft-launcher",
  "html_url": "https://github.com/storytold/craft-launcher",
  "description": null,
  "metadata": {},
  "daily_stars": [
    {
      "date": "2026-10-10",
      "stars": 8
    },
    {
      "date": "2026-10-11",
      "stars": 7
    },
    {
      "date": "2026-10-12",
      "stars": 5
    },
    {
      "date": "2026-10-13",
      "stars": 5
    },
    {
      "date": "2026-10-14",
      "stars": 8
    }
  ],
  "prediction_history": [
    {
      "date": "2026-10-20",
      "rank": 34,
      "prob": 0.0151,
      "raw_score": 0.2153,
      "b1_rank": 32
    }
  ],
  "latest_shap": [],
  "explanation": "Flagged because 9 stars in the last 3 days, stargazers star selectively and 30 stars in the last week. Held back by: recent stargazers have a good track record of finding breakouts early and the owner has 33 other repos.",
  "realized_outcome": null,
  "trending_appearances": [],
  "hn_stories": [],
  "cohort_retention": null,
  "similar_repos": null,
  "suspicion_breakdown": null
}
