{
  "repo_id": 1185223752,
  "repo_name": "repo_id=1185223752",
  "html_url": "https://github.com/repo_id=1185223752",
  "description": null,
  "metadata": {},
  "daily_stars": [],
  "prediction_history": [
    {
      "date": "2026-10-20",
      "rank": 239,
      "prob": 0.0029,
      "raw_score": 0.0324,
      "b1_rank": 260
    }
  ],
  "latest_shap": [],
  "explanation": null,
  "realized_outcome": null,
  "trending_appearances": [],
  "hn_stories": [
    {
      "title": "Show HN: Codync \u2013 Free, open-source Grok Bot alternative for any coding agent",
      "url": "https://github.com/leepokai/Codync",
      "hn_url": "https://news.ycombinator.com/item?id=49993772",
      "created_at": "2026-10-07T14:59:03",
      "points": 1,
      "num_comments": 0
    }
  ],
  "cohort_retention": null,
  "similar_repos": null,
  "suspicion_breakdown": null
}
