{
  "repo_id": 1400568925,
  "repo_name": "repo_id=1400568925",
  "html_url": "https://github.com/repo_id=1400568925",
  "description": null,
  "metadata": {},
  "daily_stars": [],
  "prediction_history": [
    {
      "date": "2026-10-20",
      "rank": 28,
      "prob": 0.0202,
      "raw_score": 0.2316,
      "b1_rank": 60
    }
  ],
  "latest_shap": [],
  "explanation": "Flagged because 10 stars in the last 3 days, recent stargazers have a good track record of finding breakouts early and stars are spread over many hours. Held back by: 1 stars yesterday and owner type unknown.",
  "realized_outcome": null,
  "trending_appearances": [],
  "hn_stories": [],
  "cohort_retention": null,
  "similar_repos": null,
  "suspicion_breakdown": null
}
