{
  "repo_id": 1423689866,
  "repo_name": "repo_id=1423689866",
  "html_url": "https://github.com/repo_id=1423689866",
  "description": null,
  "metadata": {},
  "daily_stars": [],
  "prediction_history": [
    {
      "date": "2026-10-20",
      "rank": 17,
      "prob": 0.0293,
      "raw_score": 0.2744,
      "b1_rank": 109
    }
  ],
  "latest_shap": [],
  "explanation": "Flagged because 25 stars in the last 3 days, 7 stars yesterday and recent stargazers have a good track record of finding breakouts early. Held back by: few recent pushes and owner type unknown.",
  "realized_outcome": null,
  "trending_appearances": [],
  "hn_stories": [],
  "cohort_retention": null,
  "similar_repos": null,
  "suspicion_breakdown": null
}
